{
  "$schema": "./GODSCAR_CANON_TRACE.schema.json",
  "format": "godscar-canon-trace/1",
  "publication": {
    "manifest": "estate/publication/PUBLICATION_MANIFEST.json",
    "implementedCanon": [
      "book-i-open-universe",
      "book-ii-dark-tomb",
      "book-iii-common-ship",
      "second-recension-addenda-books-i-iii"
    ],
    "publicationOnlyCanon": [
      "book-iv-lineage-commons"
    ]
  },
  "implementationBoundary": {
    "implementedVolumes": [
      "book-i",
      "book-ii",
      "book-iii",
      "second-recension"
    ],
    "stagedVolumes": [
      "book-iv"
    ]
  },
  "claims": [
    {
      "claimId": "book-i.evidence-ledger",
      "volume": "book-i",
      "recension": "first",
      "claim": "Claims retain evidence tier, venue, legitimacy target, upside, downside, failure mode, provenance, intervention, and limits rather than becoming receiver-authored certainty.",
      "evidenceTier": "settled-canon",
      "sourceAuthority": [
        "src/godscar/schema.ts",
        "src/godscar/templates.ts",
        "cartridges/kind-gods-of-ilyon.pocket.json"
      ],
      "compilerOrEngine": [
        "src/godscar/compiler.ts",
        "src/engine/cartridge-digest.ts"
      ],
      "tests": [
        "tests/godscar/",
        "tests/world/second-recension-books-1-3.test.ts"
      ],
      "references": [
        "cartridges/kind-gods-of-ilyon.arc.json",
        "docs/SECOND_RECENSION_BOOKS_I-III_ALIGNMENT.md"
      ],
      "worldRepresentations": [
        "aperture",
        "ledger",
        "result"
      ],
      "assets": [
        "src/world/themes/ilyon/",
        "docs/design/ILYON_ASSET_BIBLE.md"
      ],
      "releaseEvidence": [
        ".github/workflows/godscar-ilyon.yml",
        ".github/workflows/bundled-parity.yml"
      ],
      "status": "implemented"
    },
    {
      "claimId": "book-i.pocket-pressure",
      "volume": "book-i",
      "recension": "first",
      "claim": "A Pocket joins patron good, exclusion, trigger, resistance cost, and scale revelation into one causal mechanism whose victory changes the map.",
      "evidenceTier": "settled-canon",
      "sourceAuthority": [
        "src/godscar/schema.ts",
        "src/godscar/templates.ts"
      ],
      "compilerOrEngine": [
        "src/godscar/compiler.ts",
        "src/engine/access.ts",
        "src/engine/cycle.ts"
      ],
      "tests": [
        "tests/godscar/",
        "tests/world/bundled-campaign-parity.test.ts"
      ],
      "references": [
        "cartridges/kind-gods-of-ilyon.pocket.json",
        "cartridges/kind-gods-of-ilyon.arc.json"
      ],
      "worldRepresentations": [
        "board",
        "map",
        "hall",
        "encounter",
        "aperture"
      ],
      "assets": [
        "src/world/themes/ilyon/motif-icons.tsx",
        "src/world/themes/ilyon/portrait-icons.tsx"
      ],
      "releaseEvidence": [
        ".github/workflows/godscar-ilyon.yml"
      ],
      "status": "implemented"
    },
    {
      "claimId": "book-i.consequence-plane",
      "volume": "second-recension",
      "recension": "second",
      "claim": "Pocket actions can enter a bounded Pocket-Route-Sector-Cascade consequence ledger without allowing a distant Greatform to erase local agency.",
      "evidenceTier": "settled-canon",
      "sourceAuthority": [
        "src/godscar/second-recension.ts",
        "src/godscar/templates.ts",
        "cartridges/kind-gods-of-ilyon.pocket.json"
      ],
      "compilerOrEngine": [
        "src/godscar/index.ts",
        "src/engine/portable-run.ts"
      ],
      "tests": [
        "tests/godscar/second-recension.test.ts",
        "tests/world/second-recension-books-1-3.test.ts"
      ],
      "references": [
        "docs/SECOND_RECENSION_BOOKS_I-III_ALIGNMENT.md"
      ],
      "worldRepresentations": [
        "aperture",
        "ledger"
      ],
      "assets": [
        "src/world/themes/ilyon/motif-icons.tsx"
      ],
      "releaseEvidence": [
        ".github/workflows/bundled-parity.yml"
      ],
      "status": "implemented"
    },
    {
      "claimId": "book-i.no-clean-reset",
      "volume": "book-i",
      "recension": "first",
      "claim": "Resolution closes one decision while preserving changed people, routes, dependencies, evidence, trauma, and future pressure in the run.",
      "evidenceTier": "settled-canon",
      "sourceAuthority": [
        "src/godscar/schema.ts"
      ],
      "compilerOrEngine": [
        "src/engine/cycle.ts",
        "src/engine/save.ts",
        "src/engine/portable-run.ts"
      ],
      "tests": [
        "tests/engine/portable-run.test.ts",
        "tests/world/bundled-campaign-parity.test.ts"
      ],
      "references": [
        "docs/RODOH_1_0_ACCEPTANCE.md"
      ],
      "worldRepresentations": [
        "result",
        "ledger",
        "hall",
        "map"
      ],
      "assets": [],
      "releaseEvidence": [
        ".github/workflows/bundled-parity.yml"
      ],
      "status": "implemented"
    },
    {
      "claimId": "book-ii.maintained-misclassification",
      "volume": "book-ii",
      "recension": "first",
      "claim": "A Dark Tomb survives because institutions actively maintain an exterior classification of death, emptiness, ruin, harmlessness, primitiveness, or prior consumption.",
      "evidenceTier": "settled-canon",
      "sourceAuthority": [
        "src/dark-tomb/schema.ts",
        "src/dark-tomb/templates.ts",
        "cartridges/lamp-district.tomb.json"
      ],
      "compilerOrEngine": [
        "src/dark-tomb/compiler.ts",
        "src/engine/state.ts"
      ],
      "tests": [
        "tests/dark-tomb/lamp-district.test.ts",
        "tests/world/underworld-receiver.test.ts"
      ],
      "references": [
        "cartridges/lamp-district.arc.json",
        "docs/LAMP_DISTRICT_WORLD_ACCEPTANCE.md"
      ],
      "worldRepresentations": [
        "underworld",
        "map",
        "hall",
        "encounter",
        "ledger"
      ],
      "assets": [
        "src/assets/lamp-district/underworld/",
        "docs/design/LAMP_DISTRICT_ASSET_BIBLE.md"
      ],
      "releaseEvidence": [
        "e2e/lamp-district-gate4.spec.ts",
        ".github/workflows/bundled-parity.yml"
      ],
      "status": "implemented"
    },
    {
      "claimId": "book-ii.long-alarm",
      "volume": "book-ii",
      "recension": "first",
      "claim": "The Long Alarm is an auditable emergency constitution whose phases protect the Tomb while imposing named internal costs and whose wake state survives the run.",
      "evidenceTier": "settled-canon",
      "sourceAuthority": [
        "src/dark-tomb/schema.ts",
        "src/dark-tomb/lamp-district.ts"
      ],
      "compilerOrEngine": [
        "src/dark-tomb/compiler.ts",
        "src/engine/state.ts"
      ],
      "tests": [
        "tests/dark-tomb/lamp-district.test.ts",
        "tests/world/underworld-receiver.test.ts"
      ],
      "references": [
        "cartridges/lamp-district.tomb.json",
        "cartridges/lamp-district.arc.json"
      ],
      "worldRepresentations": [
        "underworld",
        "result",
        "ledger"
      ],
      "assets": [
        "src/assets/lamp-district/underworld/lamp-district-cross-section.svg"
      ],
      "releaseEvidence": [
        "docs/LAMP_DISTRICT_WORLD_ACCEPTANCE.md"
      ],
      "status": "implemented"
    },
    {
      "claimId": "book-ii.layer-and-signature",
      "volume": "book-ii",
      "recension": "first",
      "claim": "The seven layers, five-dimensional depth vector, and signature budget make every room and comfort legible as an inhabited political and physical system with wake.",
      "evidenceTier": "settled-canon",
      "sourceAuthority": [
        "src/dark-tomb/schema.ts",
        "cartridges/lamp-district.tomb.json"
      ],
      "compilerOrEngine": [
        "src/dark-tomb/compiler.ts"
      ],
      "tests": [
        "tests/dark-tomb/lamp-district.test.ts",
        "tests/world/lamp-district-assets.test.ts"
      ],
      "references": [
        "docs/design/LAMP_DISTRICT_ASSET_BIBLE.md"
      ],
      "worldRepresentations": [
        "underworld",
        "map",
        "aperture"
      ],
      "assets": [
        "src/assets/lamp-district/underworld/lamp-district-cross-section.svg",
        "src/assets/lamp-district/underworld/lamp-district-environment.svg"
      ],
      "releaseEvidence": [
        "e2e/lamp-district-gate4.spec.ts"
      ],
      "status": "implemented"
    },
    {
      "claimId": "book-ii.living-tomb-recension",
      "volume": "second-recension",
      "recension": "second",
      "claim": "Lineage scars, reproductive signature costs, sovereign surface populations, Negative Confederations, living hosts, chronal hosts, and layered opening are additive Book II law.",
      "evidenceTier": "settled-canon",
      "sourceAuthority": [
        "src/godscar/second-recension.ts",
        "src/dark-tomb/templates.ts",
        "src/dark-tomb/lamp-district.ts"
      ],
      "compilerOrEngine": [
        "src/dark-tomb/compiler.ts"
      ],
      "tests": [
        "tests/godscar/second-recension.test.ts",
        "tests/dark-tomb/lamp-district.test.ts",
        "tests/world/second-recension-books-1-3.test.ts"
      ],
      "references": [
        "docs/SECOND_RECENSION_BOOKS_I-III_ALIGNMENT.md"
      ],
      "worldRepresentations": [
        "underworld",
        "ledger",
        "aperture"
      ],
      "assets": [],
      "releaseEvidence": [
        ".github/workflows/bundled-parity.yml"
      ],
      "status": "implemented"
    },
    {
      "claimId": "book-iii.embodiment-profile",
      "volume": "book-iii",
      "recension": "first",
      "claim": "Embodiment profiles record scale, occupied volume, minimum passage, environment, sensorium, interface, time, and lineage dependency without converting bodies into occupations.",
      "evidenceTier": "settled-canon",
      "sourceAuthority": [